{
  "schemaVersion": "results-archive-beta-season.v1",
  "apiVersion": "1.1.0",
  "releaseChannel": "beta",
  "season": 1950,
  "dataStatus": "provisional",
  "archiveAsOfDate": "1950-09-03",
  "sourceCoverage": {
    "checkpointType": "verified",
    "sourceChecksumSha256": "333220d404f3365434b14f8d7fb5977251581a0ec570ca8c301888477d321299",
    "statusExplanation": "Canonical historical classifications are published as Beta provisional data; the checkpoint type is provenance and is not row-by-row publication approval."
  },
  "coverage": {
    "raceCount": 7,
    "classificationRowCount": 160,
    "verifiedRaceCount": 0,
    "provisionalRaceCount": 7
  },
  "unsupportedFields": [
    {
      "field": "classification.entrant",
      "reasonCode": "entrant_identity_not_available",
      "reason": "The canonical snapshot identifies constructors but does not contain a separate historical entrant identity contract."
    }
  ],
  "championship": {
    "dataStatus": "provisional",
    "drivers": [
      {
        "id": "driver:farina:edc963649157",
        "name": "Nino Farina",
        "aliases": []
      }
    ],
    "constructors": []
  },
  "standings": {
    "drivers": [
      {
        "position": 1,
        "entity": {
          "id": "driver:farina:edc963649157",
          "name": "Nino Farina",
          "aliases": []
        },
        "points": 30,
        "wins": 3,
        "dataStatus": "provisional"
      },
      {
        "position": 2,
        "entity": {
          "id": "driver:fangio:56835a0b6237",
          "name": "Juan Fangio",
          "aliases": []
        },
        "points": 27,
        "wins": 3,
        "dataStatus": "provisional"
      },
      {
        "position": 3,
        "entity": {
          "id": "driver:fagioli:05eb09dda820",
          "name": "Luigi Fagioli",
          "aliases": []
        },
        "points": 24,
        "wins": 0,
        "dataStatus": "provisional"
      },
      {
        "position": 4,
        "entity": {
          "id": "driver:rosier:bd061633165d",
          "name": "Louis Rosier",
          "aliases": []
        },
        "points": 13,
        "wins": 0,
        "dataStatus": "provisional"
      },
      {
        "position": 5,
        "entity": {
          "id": "driver:ascari:ad5589a1c97f",
          "name": "Alberto Ascari",
          "aliases": []
        },
        "points": 11,
        "wins": 0,
        "dataStatus": "provisional"
      },
      {
        "position": 6,
        "entity": {
          "id": "driver:parsons:0c0bd75f4db3",
          "name": "Johnnie Parsons",
          "aliases": []
        },
        "points": 9,
        "wins": 1,
        "dataStatus": "provisional"
      },
      {
        "position": 7,
        "entity": {
          "id": "driver:holland:f2f212d0a58e",
          "name": "Bill Holland",
          "aliases": []
        },
        "points": 6,
        "wins": 0,
        "dataStatus": "provisional"
      },
      {
        "position": 8,
        "entity": {
          "id": "driver:bira:a4f3f13ea879",
          "name": "Prince Bira",
          "aliases": []
        },
        "points": 5,
        "wins": 0,
        "dataStatus": "provisional"
      },
      {
        "position": 9,
        "entity": {
          "id": "driver:whitehead:bcd77a827191",
          "name": "Peter Whitehead",
          "aliases": []
        },
        "points": 4,
        "wins": 0,
        "dataStatus": "provisional"
      },
      {
        "position": 10,
        "entity": {
          "id": "driver:chiron:fb2a679a6025",
          "name": "Louis Chiron",
          "aliases": []
        },
        "points": 4,
        "wins": 0,
        "dataStatus": "provisional"
      },
      {
        "position": 11,
        "entity": {
          "id": "driver:reg-parnell:2af78d34e726",
          "name": "Reg Parnell",
          "aliases": []
        },
        "points": 4,
        "wins": 0,
        "dataStatus": "provisional"
      },
      {
        "position": 12,
        "entity": {
          "id": "driver:rose:9326f1bb5ba7",
          "name": "Mauri Rose",
          "aliases": []
        },
        "points": 4,
        "wins": 0,
        "dataStatus": "provisional"
      },
      {
        "position": 13,
        "entity": {
          "id": "driver:serafini:edbe23499ea0",
          "name": "Dorino Serafini",
          "aliases": []
        },
        "points": 3,
        "wins": 0,
        "dataStatus": "provisional"
      },
      {
        "position": 14,
        "entity": {
          "id": "driver:cabantous:1a7ae103507a",
          "name": "Yves Cabantous",
          "aliases": []
        },
        "points": 3,
        "wins": 0,
        "dataStatus": "provisional"
      },
      {
        "position": 15,
        "entity": {
          "id": "driver:sommer:c16ee2e5b125",
          "name": "Raymond Sommer",
          "aliases": []
        },
        "points": 3,
        "wins": 0,
        "dataStatus": "provisional"
      },
      {
        "position": 16,
        "entity": {
          "id": "driver:manzon:d6fb01b246ff",
          "name": "Robert Manzon",
          "aliases": []
        },
        "points": 3,
        "wins": 0,
        "dataStatus": "provisional"
      },
      {
        "position": 17,
        "entity": {
          "id": "driver:green:bc7e3e9b1a05",
          "name": "Cecil Green",
          "aliases": []
        },
        "points": 3,
        "wins": 0,
        "dataStatus": "provisional"
      },
      {
        "position": 18,
        "entity": {
          "id": "driver:etancelin:9a7ee5820715",
          "name": "Philippe Étancelin",
          "aliases": []
        },
        "points": 3,
        "wins": 0,
        "dataStatus": "provisional"
      },
      {
        "position": 19,
        "entity": {
          "id": "driver:bonetto:0c035a17b002",
          "name": "Felice Bonetto",
          "aliases": []
        },
        "points": 2,
        "wins": 0,
        "dataStatus": "provisional"
      },
      {
        "position": 20,
        "entity": {
          "id": "driver:chaboud:39050d9718a9",
          "name": "Eugène Chaboud",
          "aliases": []
        },
        "points": 1,
        "wins": 0,
        "dataStatus": "provisional"
      },
      {
        "position": 21,
        "entity": {
          "id": "driver:bettenhausen:63acf7dcd43a",
          "name": "Tony Bettenhausen",
          "aliases": []
        },
        "points": 1,
        "wins": 0,
        "dataStatus": "provisional"
      },
      {
        "position": 22,
        "entity": {
          "id": "driver:chitwood:b626f9ec9f82",
          "name": "Joie Chitwood",
          "aliases": []
        },
        "points": 1,
        "wins": 0,
        "dataStatus": "provisional"
      }
    ],
    "constructors": []
  },
  "races": [
    {
      "id": "event:1950-1:17e7244241b0",
      "slug": "british-grand-prix",
      "round": 1,
      "grandPrixName": "British Grand Prix",
      "date": "1950-05-13",
      "circuitId": "silverstone",
      "dataStatus": "provisional",
      "winner": {
        "drivers": [
          {
            "id": "driver:farina:edc963649157",
            "name": "Nino Farina",
            "aliases": []
          }
        ],
        "constructors": [
          {
            "id": "constructor:alfa:f3891f4c8109",
            "name": "Alfa Romeo",
            "aliases": []
          }
        ],
        "laps": 70,
        "time": "2:13:23.600",
        "sharedDrive": false,
        "deadHeat": false
      },
      "classification": [
        {
          "rowId": "race-classification:event-1950-1-17e7244241b0-3a5a0b2a5cb41194d015cbdeec593c75809149a2f7f9aa:5021a7f4d6e3",
          "classificationOrder": 1,
          "position": 1,
          "driver": {
            "id": "driver:farina:edc963649157",
            "name": "Nino Farina",
            "aliases": []
          },
          "constructor": {
            "id": "constructor:alfa:f3891f4c8109",
            "name": "Alfa Romeo",
            "aliases": []
          },
          "entrant": null,
          "carNumber": "2",
          "gridPosition": 1,
          "officialPole": false,
          "fastestLap": null,
          "entered": true,
          "started": true,
          "finished": true,
          "classified": true,
          "laps": 70,
          "timeOrRetired": "2:13:23.600",
          "points": 9,
          "sharedDrive": false,
          "sharedDriveGroupId": null,
          "deadHeat": false,
          "deadHeatGroupId": null,
          "creditedWin": true,
          "creditedPodium": true,
          "dataStatus": "provisional"
        },
        {
          "rowId": "race-classification:event-1950-1-17e7244241b0-ee43f10eea6d6a89d9e6782dbe2d552ec3d934554f9d83:b7a330629670",
          "classificationOrder": 2,
          "position": 2,
          "driver": {
            "id": "driver:fagioli:05eb09dda820",
            "name": "Luigi Fagioli",
            "aliases": []
          },
          "constructor": {
            "id": "constructor:alfa:f3891f4c8109",
            "name": "Alfa Romeo",
            "aliases": []
          },
          "entrant": null,
          "carNumber": "3",
          "gridPosition": 2,
          "officialPole": false,
          "fastestLap": null,
          "entered": true,
          "started": true,
          "finished": true,
          "classified": true,
          "laps": 70,
          "timeOrRetired": "+2.600",
          "points": 6,
          "sharedDrive": false,
          "sharedDriveGroupId": null,
          "deadHeat": false,
          "deadHeatGroupId": null,
          "creditedWin": false,
          "creditedPodium": true,
          "dataStatus": "provisional"
        },
        {
          "rowId": "race-classification:event-1950-1-17e7244241b0-e0ec0d3b3dbb8eabab875176820eae390fbb790ffa2743:d0f674203d3d",
          "classificationOrder": 3,
          "position": 3,
          "driver": {